[
  {
    "id": "v1-pre-validation",
    "title": "ATOMS-V1 pre-validation freeze",
    "date": "2026-07-13",
    "summary": "The ATOMS-V1 inventory and early validation state were preserved before later representation tests.",
    "type": "freeze",
    "tag": "v1-pre-validation",
    "commit": "91160c080a2e98345e43e96862bceac8e4c92892",
    "sequenceIndex": 1,
    "links": [
      {
        "label": "ATOMS-V1 specification",
        "path": "labs/grammar-discovery/docs/ATOMS-V1-SPECIFICATION.md"
      }
    ]
  },
  {
    "id": "grammar-v1",
    "title": "GRAMMAR-V1 frozen",
    "date": "2026-07-13",
    "summary": "The molecular substitution and optional families were frozen for held-out validation.",
    "type": "freeze",
    "tag": "grammar-v1",
    "commit": "af5f9a20e2e327befad95a63d44488d8984eb797",
    "sequenceIndex": 2,
    "links": [
      {
        "label": "Frozen manifest",
        "path": "labs/grammar-discovery/frozen/GRAMMAR-V1-2026-07-13/MANIFEST.md"
      }
    ]
  },
  {
    "id": "reproducible-release-v1",
    "title": "Reproducible Release V1",
    "date": "2026-07-13",
    "summary": "The frozen GRAMMAR-V1 validation pipeline was published with expected outputs and checksums.",
    "type": "release",
    "tag": "reproducible-release-v1",
    "commit": "a57b727968cf27b0fdcb232cb31ed764bd7e3e49",
    "sequenceIndex": 3,
    "links": [
      {
        "label": "Validation summary",
        "path": "research/artifacts/public/grammar-v1-f2r-validation/report.md"
      }
    ]
  },
  {
    "id": "atoms-eva-regional-v1",
    "title": "ATOMS-EVA regional comparison",
    "date": "2026-07-13",
    "summary": "Regional alignment enabled a matched ATOMS/EVA comparison and preserved negative null-control results.",
    "type": "comparison",
    "tag": "atoms-eva-regional-v1",
    "commit": "c1bd90e8e8cb64f2b5bc9c72f50e62719cb533a9",
    "sequenceIndex": 4,
    "links": [
      {
        "label": "Regional comparison",
        "path": "research/artifacts/public/representation-comparison-v2-regions/report.md"
      }
    ]
  },
  {
    "id": "atoms-eva-ablations-v1",
    "title": "ATOMS-EVA ablation robustness",
    "date": "2026-07-14",
    "summary": "Ablation tests showed that the ATOMS advantage did not depend only on exact regional sequence length.",
    "type": "comparison",
    "tag": "atoms-eva-ablations-v1",
    "commit": "2ee61884bae295aa2ab99cb881148ea50a383672",
    "sequenceIndex": 5,
    "links": [
      {
        "label": "Ablation report",
        "path": "research/artifacts/public/representation-comparison-v3-ablations/report.md"
      }
    ]
  },
  {
    "id": "public-portal-v1",
    "title": "Public portal V1",
    "date": "2026-07-14",
    "summary": "The first static public portal was created as a clean entry point over the research artifacts.",
    "type": "portal",
    "tag": "public-portal-v1",
    "commit": "3f4bd8cc81885f2750cedd5f00dac6bd5082c1ee",
    "sequenceIndex": 6,
    "links": [
      {
        "label": "Portal source",
        "path": "apps/portal/README.md"
      }
    ]
  },
  {
    "id": "prospective-atoms-eva-test-v1-preregistration",
    "title": "Prospective ATOMS-EVA test preregistered",
    "date": "2026-07-14",
    "summary": "Protocol, models, metrics, and interpretation rules were frozen publicly before completion of the next annotated folio.",
    "type": "registry",
    "tag": "prospective-atoms-eva-test-v1-preregistered",
    "commit": "aa016af6bcae96c7d02f8196a93558f626659f9d",
    "sequenceIndex": 7,
    "links": [
      {
        "label": "Preregistration",
        "path": "research/preregistrations/prospective-atoms-eva-test-v1/PREREGISTRATION.md"
      }
    ]
  },
  {
    "id": "prospective-atoms-eva-test-v1",
    "title": "Prospective ATOMS-EVA test completed",
    "date": "2026-07-14",
    "summary": "The preregistered f3r test replicated the ATOMS advantage over EVA under frozen local-context metrics.",
    "type": "comparison",
    "tag": "prospective-atoms-eva-test-v1",
    "commit": "8137d72d5b979d296f6def65b87f1cca1f48288a",
    "sequenceIndex": 8,
    "links": [
      {
        "label": "Prospective test report",
        "path": "research/artifacts/public/prospective-atoms-eva-test-v1/report.md"
      }
    ]
  },
  {
    "id": "corpus-v2-audited",
    "title": "Corpus V2 audited robustness replay",
    "date": "2026-07-14",
    "summary": "Closed the six-folio corpus audit, removed stale learned memory, froze V2 provenance, and replayed the main ATOMS/EVA structural mathematics.",
    "type": "audit",
    "tag": "corpus-v2-audited",
    "commit": "7f168645d31130099951a1f9877c788c09274677",
    "sequenceIndex": 9,
    "links": [
      {
        "label": "Frozen manifest",
        "path": "research/frozen/CORPUS-V2-AUDITED/MANIFEST.md"
      },
      {
        "label": "CEO report",
        "path": "research/frozen/CORPUS-V2-AUDITED/reports/CEO-FINAL-CORPUS-V2-REPORT.md"
      }
    ]
  },
  {
    "id": "corpus-v1-v2-matched-comparison",
    "title": "Corpus V1 to V2 matched-folio comparison",
    "date": "2026-07-16",
    "summary": "Compared the three folios shared by the official V1 freeze and audited V2. Positional entropy decreased slightly, consistent with modest annotation-noise removal rather than a manufactured large effect.",
    "type": "comparison",
    "tag": null,
    "commit": null,
    "sequenceIndex": 10,
    "links": [
      {
        "label": "Comparison report",
        "path": "research/artifacts/public/corpus-v1-v2-matched-comparison/report.md"
      }
    ]
  }
]
